{
  "fixture_id": "keypair_dave",
  "fixture_type": "keypair",
  "version": "1.0",
  "keypair": {
    "private_key_pem": "-----BEGIN EC PRIVATE KEY-----\nMHcCAQEEIKKRQO8Xr8fY1iYNSFFWyJOXsaqvjHLJvEjEnWo/KCuToAoGCCqGSM49\nAwEHoUQDQgAEO+lkNsTbj3/HEneagKXM9eAg/H44y+AnP62EgB+2oxKxbgKoP0CV\nnc4lspGEx+nDpTMsVQorI7E2a57A+sMupw==\n-----END EC PRIVATE KEY-----\n",
    "public_key_jwk": "{\"kty\":\"EC\",\"crv\":\"P-256\",\"x\":\"O-lkNsTbj3_HEneagKXM9eAg_H44y-AnP62EgB-2oxI\",\"y\":\"sW4CqD9AlZ3OJbKRhMfpw6UzLFUKKyOxNmuewPrDLqc\"}",
    "algorithm": "ES256",
    "jwk_thumbprint": "dc109ac0334ba0467ddbb49ff3fb3f019c1ce20678b0d44edfdbd6d6a0892f58",
    "key_id": "keypair_dave"
  },
  "description": "Test keypair for Dave (auditor)",
  "tags": [
    "crypto",
    "positive"
  ],
  "created_at": "2025-10-12T00:00:00Z",
  "created_by": "generate_keypair.go"
}