{
  "fixture_id": "keypair_alice",
  "fixture_type": "keypair",
  "version": "1.0",
  "keypair": {
    "private_key_pem": "-----BEGIN EC PRIVATE KEY-----\nMHcCAQEEIPwGJFKn2nRWb84CXYy+2bXn+Z6bZ9A1+AFgq23AruSwoAoGCCqGSM49\nAwEHoUQDQgAE0fpsEQMaHi7tW+d/VRqWXr7jFrCR3AgeXxovsr29pV54tCky7wmx\n01FQSHrnzGIoIuVToLJGqU0L39jp4KLNIw==\n-----END EC PRIVATE KEY-----\n",
    "public_key_jwk": "{\"kty\":\"EC\",\"crv\":\"P-256\",\"x\":\"0fpsEQMaHi7tW-d_VRqWXr7jFrCR3AgeXxovsr29pV4\",\"y\":\"eLQpMu8JsdNRUEh658xiKCLlU6CyRqlNC9_Y6eCizSM\"}",
    "algorithm": "ES256",
    "jwk_thumbprint": "__wJbOuCEqgkhNK3p_YS6dGq_tMtdReUe_l3UciusOU",
    "key_id": "keypair_alice"
  },
  "description": "Test keypair for Alice (signer)",
  "tags": [
    "crypto",
    "positive"
  ],
  "created_at": "2025-10-12T00:00:00Z",
  "created_by": "generate_keypair.go"
}