{
  "fixture_id": "keypair_charlie",
  "fixture_type": "keypair",
  "version": "1.0",
  "keypair": {
    "private_key_pem": "-----BEGIN EC PRIVATE KEY-----\nMHcCAQEEIMDFQxqEDBfOe7i60fHMZSLuMDh5Ib0m6L1MVWPoXVLWoAoGCCqGSM49\nAwEHoUQDQgAEUrWxV0jG2HeRlls1XENqSWF9zePyIsLBF3J5EakhfCt7bz1u3J9a\n7oT+SqKleD2jy84unCYuHr5bKRwNZ1PyCA==\n-----END EC PRIVATE KEY-----\n",
    "public_key_jwk": "{\"kty\":\"EC\",\"crv\":\"P-256\",\"x\":\"UrWxV0jG2HeRlls1XENqSWF9zePyIsLBF3J5EakhfCs\",\"y\":\"e289btyfWu6E_kqipXg9o8vOLpwmLh6-WykcDWdT8gg\"}",
    "algorithm": "ES256",
    "jwk_thumbprint": "INRRbvyhKYsOnoWQaEQ01wKVlo7UkNdhZRuboomIsWo",
    "key_id": "keypair_charlie"
  },
  "description": "Test keypair for Charlie (signer)",
  "tags": [
    "crypto",
    "positive"
  ],
  "created_at": "2025-10-12T00:00:00Z",
  "created_by": "generate_keypair.go"
}