{
  "fixture_id": "keypair_eve",
  "fixture_type": "keypair",
  "version": "1.0",
  "keypair": {
    "private_key_pem": "-----BEGIN EC PRIVATE KEY-----\nMHcCAQEEINNA8q0ooEetLnnaNO5WCZWkU1O7HDxN2JhXSiZ7wgT6oAoGCCqGSM49\nAwEHoUQDQgAEddC/XRqDsgctBR398OlanAXKF6xmRZj9X0pUHF7mjVJbb3BX9GE4\nG75Os9jCPkWXL5OUnHEiKjIzoUt53KBWzQ==\n-----END EC PRIVATE KEY-----\n",
    "public_key_jwk": "{\"kty\":\"EC\",\"crv\":\"P-256\",\"x\":\"ddC_XRqDsgctBR398OlanAXKF6xmRZj9X0pUHF7mjVI\",\"y\":\"W29wV_RhOBu-TrPYwj5Fly-TlJxxIioyM6FLedygVs0\"}",
    "algorithm": "ES256",
    "jwk_thumbprint": "K4hUJp1dc-2NW0t_la91EDY0gw7XolsWOCUpIqcWc7E",
    "key_id": "keypair_eve"
  },
  "description": "Test keypair for Eve (signer)",
  "tags": [
    "crypto",
    "positive"
  ],
  "created_at": "2025-10-12T00:00:00Z",
  "created_by": "generate_keypair.go"
}